<!ELEMENT Waterball:WebSite (Waterball:restaurant*)>

<!ATTLIST Waterball:WebSite xmlns:Waterball CDATA #FIXED "http://g9.xml.csie.mcu.edu.tw">


<!ELEMENT Waterball:restaurant (Waterball:comment*)>

<!ATTLIST Waterball:restaurant id ID #REQUIRED>
<!ATTLIST Waterball:restaurant name CDATA #REQUIRED>
<!ATTLIST Waterball:restaurant latitude CDATA #REQUIRED>
<!ATTLIST Waterball:restaurant longitude CDATA #REQUIRED>
<!ATTLIST Waterball:restaurant price CDATA #REQUIRED>
<!ATTLIST Waterball:restaurant typeOfMeal CDATA #REQUIRED>
<!ATTLIST Waterball:restaurant address CDATA #REQUIRED>

<!ELEMENT Waterball:comment (Waterball:name+,Waterball:date+,Waterball:content+)>
<!ELEMENT Waterball:name (#PCDATA)>
<!ELEMENT Waterball:date (#PCDATA)>
<!ELEMENT Waterball:content (#PCDATA)>

<!ATTLIST Waterball:comment rate CDATA #REQUIRED>