<?xml version="1.0" encoding="UTF-8"?>
<!DOCTYPE Waterball:WebSite SYSTEM "triMago.dtd">
<?xml-stylesheet type="text/xsl" href="index.xsl"?>
<Waterball:WebSite xmlns:Waterball="http://g9.xml.csie.mcu.edu.tw" >
	<Waterball:restaurant id="r0" name="癮食上癮" latitude="24.9966" longitude="121.336" typeOfMeal="便當飯類" price="80" address="333台灣桃園市龜山區自強西路128號">
		<Waterball:comment rate="3">
			<Waterball:name>水球</Waterball:name>
			<Waterball:date>2017/3/10</Waterball:date>
			<Waterball:content>很奇怪，他的椒麻雞，只是鹹酥雞+醬汁而已...</Waterball:content>
		</Waterball:comment>
	</Waterball:restaurant>
	<Waterball:restaurant id="r1" name="美國時間"  latitude="24.9966" longitude="121.336" typeOfMeal="早餐 早午餐" price="40" address="333台灣桃園市龜山區自強西路128號">
		<Waterball:comment rate="1">
			<Waterball:name>昇昇</Waterball:name>
			<Waterball:date>2017/3/15</Waterball:date>
			<Waterball:content>難吃，馬的。</Waterball:content>
		</Waterball:comment>
  </Waterball:restaurant>
	<Waterball:restaurant id="r2" name="Waterball Dream"  latitude="24.992495" longitude="121.339421" typeOfMeal="早餐 早午餐" price="340" address="神之地址">
		<Waterball:comment rate="5">
			<Waterball:name>Waterball</Waterball:name>
			<Waterball:date>2017/4/1</Waterball:date>
			<Waterball:content>Welcome here to have hthe most popular and romantic date!</Waterball:content>
		</Waterball:comment>
	</Waterball:restaurant>
	
</Waterball:WebSite>
